{
  "schema_version": "sys4ai.implementation-plan-state.v1",
  "plan_id": "PLAN-EXAMPLE-001",
  "plan_sha256": "0e36bea5cdc7a0cfd3e2a67cea49f14623c877368c3957d743c9992a88898bd7",
  "repository_fingerprint": "bbbbbbbbbbbbbbbbbbbbbbbbbbbbbbbbbbbbbbbbbbbbbbbbbbbbbbbbbbbbbbbb",
  "revision": 1,
  "phase": "terminal_capability_blocked",
  "current_generation": 1,
  "active_task_id": null,
  "counters": {
    "worker_discussions": 1,
    "continue_invocations": 0,
    "agentjobs": 0,
    "provider_creates": 1,
    "successor_creates": 0,
    "tasks_completed": 0,
    "tasks_superseded": 0,
    "protected_stops": 1
  },
  "lease": null,
  "evaluation": "unmet",
  "fingerprints": {
    "initial": "aaaaaaaaaaaaaaaaaaaaaaaaaaaaaaaaaaaaaaaaaaaaaaaaaaaaaaaaaaaaaaaa",
    "current": "bbbbbbbbbbbbbbbbbbbbbbbbbbbbbbbbbbbbbbbbbbbbbbbbbbbbbbbbbbbbbbbb",
    "history": [
      "aaaaaaaaaaaaaaaaaaaaaaaaaaaaaaaaaaaaaaaaaaaaaaaaaaaaaaaaaaaaaaaa",
      "bbbbbbbbbbbbbbbbbbbbbbbbbbbbbbbbbbbbbbbbbbbbbbbbbbbbbbbbbbbbbbbb"
    ]
  },
  "terminal_reason": "A synthetic required capability is unavailable.",
  "tasks": [
    {
      "task_id": "TASK-001",
      "task_sha256": "1111111111111111111111111111111111111111111111111111111111111111",
      "status": "blocked",
      "generation": 1,
      "counters": {
        "worker_discussions": 1,
        "continue_invocations": 0,
        "agentjobs": 0,
        "provider_creates": 1,
        "successor_creates": 0,
        "same_task_successors": 0
      },
      "receipt_link": {
        "receipt_id": "PTR-PHASE02-001",
        "receipt_sha256": "1111111111111111111111111111111111111111111111111111111111111111"
      },
      "fingerprint_before": "aaaaaaaaaaaaaaaaaaaaaaaaaaaaaaaaaaaaaaaaaaaaaaaaaaaaaaaaaaaaaaaa",
      "fingerprint_after": "bbbbbbbbbbbbbbbbbbbbbbbbbbbbbbbbbbbbbbbbbbbbbbbbbbbbbbbbbbbbbbbb",
      "terminal_reason": "Synthetic fixture terminal state: blocked.",
      "updated_at": "2026-01-01T00:01:00Z",
      "extensions": {}
    },
    {
      "task_id": "TASK-002",
      "task_sha256": "2222222222222222222222222222222222222222222222222222222222222222",
      "status": "pending",
      "generation": null,
      "counters": {
        "worker_discussions": 0,
        "continue_invocations": 0,
        "agentjobs": 0,
        "provider_creates": 0,
        "successor_creates": 0,
        "same_task_successors": 0
      },
      "receipt_link": null,
      "fingerprint_before": null,
      "fingerprint_after": null,
      "terminal_reason": null,
      "updated_at": "2026-01-01T00:00:00Z",
      "extensions": {}
    },
    {
      "task_id": "TASK-003",
      "task_sha256": "3333333333333333333333333333333333333333333333333333333333333333",
      "status": "pending",
      "generation": null,
      "counters": {
        "worker_discussions": 0,
        "continue_invocations": 0,
        "agentjobs": 0,
        "provider_creates": 0,
        "successor_creates": 0,
        "same_task_successors": 0
      },
      "receipt_link": null,
      "fingerprint_before": null,
      "fingerprint_after": null,
      "terminal_reason": null,
      "updated_at": "2026-01-01T00:00:00Z",
      "extensions": {}
    }
  ],
  "updated_at": "2026-01-01T00:20:00Z",
  "extensions": {}
}
