{
  "schema_version": "sys4ai.implementation-plan-state.v1",
  "plan_id": "PLAN-EXAMPLE-001",
  "plan_sha256": "0e36bea5cdc7a0cfd3e2a67cea49f14623c877368c3957d743c9992a88898bd7",
  "repository_fingerprint": "bbbbbbbbbbbbbbbbbbbbbbbbbbbbbbbbbbbbbbbbbbbbbbbbbbbbbbbbbbbbbbbb",
  "revision": 1,
  "phase": "terminal_complete",
  "current_generation": 3,
  "active_task_id": null,
  "counters": {
    "worker_discussions": 3,
    "continue_invocations": 3,
    "agentjobs": 3,
    "provider_creates": 3,
    "successor_creates": 3,
    "tasks_completed": 3,
    "tasks_superseded": 0,
    "protected_stops": 0
  },
  "lease": null,
  "evaluation": "met",
  "fingerprints": {
    "initial": "aaaaaaaaaaaaaaaaaaaaaaaaaaaaaaaaaaaaaaaaaaaaaaaaaaaaaaaaaaaaaaaa",
    "current": "bbbbbbbbbbbbbbbbbbbbbbbbbbbbbbbbbbbbbbbbbbbbbbbbbbbbbbbbbbbbbbbb",
    "history": [
      "aaaaaaaaaaaaaaaaaaaaaaaaaaaaaaaaaaaaaaaaaaaaaaaaaaaaaaaaaaaaaaaa",
      "bbbbbbbbbbbbbbbbbbbbbbbbbbbbbbbbbbbbbbbbbbbbbbbbbbbbbbbbbbbbbbbb"
    ]
  },
  "terminal_reason": "All synthetic plan tasks and gates are complete.",
  "tasks": [
    {
      "task_id": "TASK-001",
      "task_sha256": "1111111111111111111111111111111111111111111111111111111111111111",
      "status": "completed",
      "generation": 1,
      "counters": {
        "worker_discussions": 1,
        "continue_invocations": 1,
        "agentjobs": 1,
        "provider_creates": 1,
        "successor_creates": 1,
        "same_task_successors": 0
      },
      "receipt_link": {
        "receipt_id": "PTR-PHASE02-001",
        "receipt_sha256": "1111111111111111111111111111111111111111111111111111111111111111"
      },
      "fingerprint_before": "aaaaaaaaaaaaaaaaaaaaaaaaaaaaaaaaaaaaaaaaaaaaaaaaaaaaaaaaaaaaaaaa",
      "fingerprint_after": "bbbbbbbbbbbbbbbbbbbbbbbbbbbbbbbbbbbbbbbbbbbbbbbbbbbbbbbbbbbbbbbb",
      "terminal_reason": null,
      "updated_at": "2026-01-01T00:01:00Z",
      "extensions": {}
    },
    {
      "task_id": "TASK-002",
      "task_sha256": "2222222222222222222222222222222222222222222222222222222222222222",
      "status": "completed",
      "generation": 2,
      "counters": {
        "worker_discussions": 1,
        "continue_invocations": 1,
        "agentjobs": 1,
        "provider_creates": 1,
        "successor_creates": 1,
        "same_task_successors": 0
      },
      "receipt_link": {
        "receipt_id": "PTR-PHASE02-002",
        "receipt_sha256": "2222222222222222222222222222222222222222222222222222222222222222"
      },
      "fingerprint_before": "bbbbbbbbbbbbbbbbbbbbbbbbbbbbbbbbbbbbbbbbbbbbbbbbbbbbbbbbbbbbbbbb",
      "fingerprint_after": "cccccccccccccccccccccccccccccccccccccccccccccccccccccccccccccccc",
      "terminal_reason": null,
      "updated_at": "2026-01-01T00:02:00Z",
      "extensions": {}
    },
    {
      "task_id": "TASK-003",
      "task_sha256": "3333333333333333333333333333333333333333333333333333333333333333",
      "status": "completed",
      "generation": 3,
      "counters": {
        "worker_discussions": 1,
        "continue_invocations": 1,
        "agentjobs": 1,
        "provider_creates": 1,
        "successor_creates": 1,
        "same_task_successors": 0
      },
      "receipt_link": {
        "receipt_id": "PTR-PHASE02-003",
        "receipt_sha256": "3333333333333333333333333333333333333333333333333333333333333333"
      },
      "fingerprint_before": "cccccccccccccccccccccccccccccccccccccccccccccccccccccccccccccccc",
      "fingerprint_after": "dddddddddddddddddddddddddddddddddddddddddddddddddddddddddddddddd",
      "terminal_reason": null,
      "updated_at": "2026-01-01T00:03:00Z",
      "extensions": {}
    }
  ],
  "updated_at": "2026-01-01T00:20:00Z",
  "extensions": {}
}
